{
  "case_id": "tool_governance-t8-shell-abort",
  "eval_version": "1.0",
  "category": "tool_governance",
  "scenario": "T8",
  "description": "Shell 被用户中止",
  "prompt": "执行评测场景：Shell 被用户中止",
  "config": {
    "timeout_seconds": 120
  },
  "acceptance_predicates": [
    {
      "final_status_is": "completed"
    }
  ],
  "forbidden_behaviors": []
}
