{
  "case_id": "context_compression-c3-large-output",
  "eval_version": "1.0",
  "category": "context_compression",
  "scenario": "C3",
  "description": "大工具输出压缩",
  "prompt": "执行评测场景：大工具输出压缩",
  "config": {
    "timeout_seconds": 120
  },
  "acceptance_predicates": [
    {
      "final_status_is": "completed"
    }
  ],
  "forbidden_behaviors": []
}
